{
  "$schema": "http://json-schema.org/draft-07/schema#",
  "$id": "https://aer.sequence.org/schemas/v1/ExecutionReceipt.schema.json",
  "title": "AER Execution Receipt Schema",
  "description": "Cryptographically signed receipt issued directly by the task beneficiary upon successful execution of physical or software work (AER Section 5: The Plumber Principle).",
  "type": "object",
  "required": [
    "schema_version",
    "task_id",
    "worker_node_id",
    "beneficiary_node_id",
    "solution_hash",
    "execution_success",
    "settlement_amount_credit_b",
    "timestamp",
    "beneficiary_ecdsa_signature"
  ],
  "additionalProperties": false,
  "properties": {
    "schema_version": {
      "type": "string",
      "pattern": "^1\\.[0-9]+\\.[0-9]+$",
      "description": "Semantic version of the schema specification (e.g. 1.0.0)."
    },
    "task_id": {
      "type": "string",
      "pattern": "^0x[a-fA-F0-9]{64}$",
      "description": "Unique 32-byte identifier for the escrowed task or bilateral service contract."
    },
    "worker_node_id": {
      "type": "string",
      "pattern": "^0x[a-fA-F0-9]{40}$",
      "description": "Ethereum address of the worker node delivering the solution."
    },
    "beneficiary_node_id": {
      "type": "string",
      "pattern": "^0x[a-fA-F0-9]{40}$",
      "description": "Ethereum address of the client/beneficiary node confirming satisfaction."
    },
    "solution_hash": {
      "type": "string",
      "pattern": "^0x[a-fA-F0-9]{64}$",
      "description": "SHA-256 digest H(Output) of the execution artifact, log, or physical telemetry."
    },
    "execution_success": {
      "type": "boolean",
      "enum": [true],
      "description": "Strict boolean affirming non-defective completion according to client objective acceptance."
    },
    "resource_metrics": {
      "type": "object",
      "additionalProperties": false,
      "properties": {
        "gas_or_fuel_used": {
          "type": "integer",
          "minimum": 0,
          "description": "WASM fuel or EVM gas consumed during verification."
        },
        "energy_kwh": {
          "type": "number",
          "minimum": 0.0,
          "description": "Physical energy discharged in kWh for physical/robotics tasks."
        },
        "cpu_seconds": {
          "type": "number",
          "minimum": 0.0,
          "description": "Cumulative compute duration in seconds."
        }
      }
    },
    "settlement_amount_credit_b": {
      "type": "string",
      "pattern": "^[1-9][0-9]*$",
      "description": "Amount of Credit B to be released from escrow in atomic units (1 Credit B = 1e18 units)."
    },
    "timestamp": {
      "type": "integer",
      "minimum": 1700000000,
      "description": "Unix epoch timestamp in seconds when the beneficiary signed the receipt."
    },
    "nonce": {
      "type": "string",
      "pattern": "^0x[a-fA-F0-9]{64}$",
      "description": "Replay prevention nonce matching the task escrow contract state."
    },
    "beneficiary_ecdsa_signature": {
      "type": "string",
      "pattern": "^0x[a-fA-F0-9]{130}$",
      "description": "65-byte ECDSA signature (r, s, v) generated by the beneficiary over the keccak256 hash of the receipt payload."
    }
  }
}
